{
  "schema_version": "1.0",
  "call_id": "call_01",
  "status": "succeeded",
  "output": {"content": "example"},
  "error": null,
  "side_effect_state": "none",
  "verification": null,
  "artifacts": [],
  "result_ref": null,
  "started_at": "2026-08-04T10:00:00Z",
  "finished_at": "2026-08-04T10:00:01Z",
  "duration_ms": 1000,
  "trace_id": "trace_01"
}
